<?xml version="1.0" encoding="UTF-8"?>
<!-- XML Sample Message of message hierarchy                                          -->
<!-- Message:             ADC PUR Materials Received v1.0 Rev. 5                      -->
<!-- Transaction:         AA - Audit Data Collection Rev. 271                         -->
<!-- Datamodel:           Audit Data Collection Datamodel, version HEAD Rev. 347      -->
<!-- XML tagset used:     AdcsML                                                      -->
<!-- Generated at:        02-05-2021 16:04:28                                         -->
<!-- Generated using:     EC-Design 2.5.0 (http://www.ec-design.nl)                   -->
<!-- Generated by:        Jan Vrijenhoek (Digitect)                                   -->
<!-- Organisation:        Digitect B.V. (Digitect)                                    -->
<!-- NOTE:    This sample message was generated automatically: manual modifications will be lost -->
<AdcPurMaterialsReceived xsi:schemaLocation="http://schemas.iso.org/AdcsML/Messages/AdcPurMaterialsReceived-v1 AdcPurMaterialsReceived.xsd"
		xmlns="http://schemas.iso.org/AdcsML/Messages/AdcPurMaterialsReceived-v1"
		xmlns:xsi="http://www.w3.org/2001/XMLSchema-instance">
	<PurMatRcvd>
		<RcptId>RC1234</RcptId>
		<RcptNr>123456789</RcptNr>
		<FiscYr>2020</FiscYr>
		<AcntingPer>M1</AcntingPer>
		<RcptOrgCd>BS001</RcptOrgCd>
		<RcptDt>2020-02-29</RcptDt>
		<RcptRefNr>123456789</RcptRefNr>
		<RcptTrAmt>10000.0000</RcptTrAmt>
		<RcptTrCurCd>USD</RcptTrCurCd>
		<ShpngMthd>Air</ShpngMthd>
		<Shipper>International Post</Shipper>
		<AdjInd>0</AdjInd>
		<AdjDscr>Final delivery.</AdjDscr>
		<SuplAcntId>S00001</SuplAcntId>
		<PurOrdId>ORDER1234</PurOrdId>
		<Crea>
			<UserId>JD</UserId>
			<Dt>2020-03-02</Dt>
			<Tm>09:31</Tm>
		</Crea>
		<Aprv>
			<UserId>JD</UserId>
			<Dt>2020-03-02</Dt>
			<Tm>09:31</Tm>
		</Aprv>
		<LstMdf>
			<UserId>JD</UserId>
			<Dt>2020-03-02</Dt>
			<Tm>09:31</Tm>
		</LstMdf>
		<BusSg>
			<BusSgCd>1234</BusSgCd>
		</BusSg>
	</PurMatRcvd>
</AdcPurMaterialsReceived>
